{
  "timestamp": "2024-10-28T04:49:20.494806",
  "summary": "### GitHub Notifications Summary\n\n#### Repository: PrefectHQ/prefect\n- **Pull Request**: [Docs Prefect logo link to prefect.io](https://api.github.com/repos/PrefectHQ/prefect/pulls/15524)\n  - **Type**: Review Requested\n  - **Timestamp**: 2024-10-28T04:49:02.430991\n  - **Urgency**: The notification is for a review request. There is no mention of failures on the `main` or `2.x` branches, nor is it noted as a serious PR or security issue. Therefore, it does not require immediate attention based on the current criteria.\n\nThere are no other notifications related to PrefectHQ/prefect-* that require urgent attention based on the criteria provided. If more notifications were present, they would be summarized in a similar manner.",
  "events": [
    {
      "type": "github",
      "timestamp": "2024-10-28T04:49:02.430991",
      "title": "Docs Prefect logo link to prefect.io",
      "repository": "PrefectHQ/prefect",
      "notification_type": "PullRequest",
      "reason": "review_requested",
      "url": "https://api.github.com/repos/PrefectHQ/prefect/pulls/15524"
    }
  ],
  "source_types": [
    "github"
  ]
}
